{"$schema":"https://json-schema.org/draft/2020-12/schema","type":"object","additionalProperties":false,"required":["schema_version","project_id","revision","summary","body","updated_by","updated_at"],"properties":{"schema_version":{"const":1},"project_id":{"type":"string"},"revision":{"type":"integer","minimum":1},"summary":{"type":"string","minLength":1,"maxLength":500},"body":{"type":"string","maxLength":200000},"active_task_id":{"type":"string"},"active_run_id":{"type":"string"},"updated_by":{"type":"string"},"updated_at":{"type":"string","format":"date-time"}}}
